{
  "name": "geldmacher-efficiency",
  "displayName": "Efficiency",
  "description": "Helps coding agents choose simpler solutions, keep context lean, and communicate clearly. For Cursor and Codex.",
  "version": "3.13.0",
  "author": {
    "name": "Dennis Geldmacher",
    "email": "geldmacher.dennis@outlook.de"
  },
  "license": "MIT",
  "homepage": "https://github.com/geldmacher/efficiency",
  "repository": "https://github.com/geldmacher/efficiency",
  "category": "developer-tools",
  "keywords": [
    "simplicity",
    "coding-agents",
    "cursor",
    "codex",
    "context",
    "refactoring",
    "review",
    "over-engineering",
    "yagni",
    "kiss",
    "dry",
    "rtk"
  ],
  "tags": [
    "simplicity",
    "coding-agents",
    "context",
    "refactoring",
    "rtk"
  ],
  "logo": "assets/logo.svg",
  "commands": "./commands/",
  "agents": "./agents/",
  "skills": [
    "./skills/context-optimization/SKILL.md",
    "./skills/efficiency/SKILL.md",
    "./skills/install-new-release-from-repo/SKILL.md",
    "./skills/rtk-filter-design/SKILL.md",
    "./skills/rtk-setup/SKILL.md",
    "./skills/rtk-update/SKILL.md"
  ],
  "rules": "./rules/"
}
